001:030:004:DESCRIPTOR         1530247773.665635
 05 01 09 06 A1 01 05 07 19 E0 29 E7 15 00 25 01
 95 08 75 01 81 02 05 08 19 01 29 05 95 05 75 01
 91 02 95 01 75 03 91 01 05 07 19 00 29 F7 15 00
 25 01 95 F8 75 01 81 02 C0

001:030:003:DESCRIPTOR         1530247773.665871
 06 31 FF 09 74 A1 01 09 75 15 00 26 FF 00 95 20
 75 08 81 02 09 76 15 00 26 FF 00 95 20 75 08 91
 02 C0

001:030:001:DESCRIPTOR         1530247773.666021
 06 00 FF 09 01 A1 01 09 02 15 00 26 FF 00 95 40
 75 08 81 02 09 03 15 00 26 FF 00 95 40 75 08 91
 02 C0

001:030:002:DESCRIPTOR         1530247773.666213
 05 01 09 80 A1 01 85 02 16 01 00 26 03 00 1A 81
 00 2A 83 00 75 10 95 01 81 00 C0 05 0C 09 01 A1
 01 85 03 16 01 00 26 9C 02 1A 01 00 2A 9C 02 75
 10 95 01 81 00 C0

001:030:000:DESCRIPTOR         1530247773.666448
 05 01 09 06 A1 01 05 07 19 E0 29 E7 15 00 25 01
 95 08 75 01 81 02 95 01 75 08 81 01 05 08 19 01
 29 05 95 05 75 01 91 02 95 01 75 03 91 01 05 07
 19 00 29 FF 15 00 26 FF 00 95 06 75 08 81 00 C0

